{
  "$schema": "https://json-schema.org/draft/2020-12/schema",
  "title": "AI Development Kit Capability Manifest",
  "type": "object",
  "required": [
    "id",
    "version",
    "category",
    "depends_on",
    "conflicts_with",
    "skills",
    "scaffold",
    "validate"
  ],
  "properties": {
    "id": {
      "type": "string",
      "pattern": "^[a-z0-9]+(?:[.-][a-z0-9]+)*$"
    },
    "version": {
      "type": "string"
    },
    "category": {
      "type": "string"
    },
    "aliases": {
      "type": "array",
      "items": {
        "type": "string"
      }
    },
    "depends_on": {
      "type": "array",
      "items": {
        "type": "string"
      }
    },
    "conflicts_with": {
      "type": "array",
      "items": {
        "type": "string"
      }
    },
    "skills": {
      "type": "array",
      "items": {
        "type": "string"
      }
    },
    "scaffold": {
      "type": "object",
      "required": [
        "mode"
      ],
      "properties": {
        "mode": {
          "enum": [
            "script",
            "none"
          ]
        },
        "script": {
          "type": [
            "string",
            "null"
          ]
        },
        "arguments": {
          "type": "object"
        }
      }
    },
    "validate": {
      "type": "object",
      "required": [
        "mode"
      ],
      "properties": {
        "mode": {
          "enum": [
            "script",
            "files",
            "none"
          ]
        },
        "script": {
          "type": [
            "string",
            "null"
          ]
        },
        "files": {
          "type": "array",
          "items": {
            "type": "string"
          }
        }
      }
    }
  }
}
