{
  "id": "cache.redis",
  "version": "1.0",
  "category": "cache",
  "aliases": [
    "redis"
  ],
  "depends_on": [],
  "conflicts_with": [],
  "skills": [
    "redis",
    "caching",
    "queues"
  ],
  "scaffold": {
    "mode": "script",
    "script": "scripts/scaffold-redis.ps1",
    "arguments": {}
  },
  "validate": {
    "mode": "files",
    "script": null,
    "files": [
      "infrastructure/docker-compose.redis.yml"
    ]
  }
}